{
  "schemaVersion": "1.0.0",
  "reviewId": "ARC-0205",
  "generatedAt": "2026-09-05T17:05:00.000Z",
  "scope": {
    "components": ["Registry-free CLI and private internal package", "Release build, checksum, SBOM, provenance, signature, and independent-review gates", "GitHub Actions validation and CodeQL workflows", "Transactional project creation, adoption, rollback, and recovery", "Schema-governed reports, skill catalog, and shipped templates"],
    "environments": ["Local Windows validation", "GitHub-hosted Windows, Linux, and macOS runners", "Authorized internal package consumption"],
    "targetCloud": "unknown",
    "regions": [],
    "excluded": ["Live Azure resources and deployed workload posture", "Remote mutation, release publication, and package promotion", "Unreachable or pruned Git objects"]
  },
  "coverage": [
    { "pillar": "reliability", "assessed": true, "evidence": ["Transactional adoption journals, locks, rollback, and recovery are documented in docs/THREAT-MODEL.md and exercised by npm run check.", "The current unsigned candidate verifies 151 checksum-covered files."] },
    { "pillar": "security", "assessed": true, "evidence": ["Local security and Gitleaks scans pass with pinned tools and immutable workflow actions.", "Production verification requires trusted RSA signatures and independently signed review evidence.", "Read-only GitHub inspection found no main-branch protection or rulesets and disabled hosted secret/dependency protections."] },
    { "pillar": "cost-optimization", "assessed": true, "evidence": ["The package has zero runtime dependencies and no always-on service cost.", "Hosted validation uses bounded jobs and retention windows; no deployment resources are part of this package release."] },
    { "pillar": "operational-excellence", "assessed": true, "evidence": ["JSON schemas, immutable execution snapshots, release checks, and 43 skill contracts provide deterministic operations evidence.", "Merge commit 5190959 passed nine OS/Node jobs, three Gitleaks jobs, aggregate evidence, and CodeQL.", "Candidate-bound operational evidence blocks on unconfigured internal artifact health and untested revocation."] },
    { "pillar": "performance-efficiency", "assessed": true, "evidence": ["Repository scans and project discovery are bounded; the complete local gate passes within its configured CI timeout.", "No application runtime or deployed service performance is in scope."] }
  ],
  "findings": [
    {
      "id": "ARCF-0205",
      "title": "Hosted source changes do not require an independent human review",
      "pillar": "security",
      "location": "github.com/QuyDu/Skills-Orchestrator settings and main branch",
      "impact": "Automated Security Validation and CodeQL checks are enforced, but the sole write-capable maintainer can still merge a change without a second person reviewing it. This leaves human design and intent defects outside automated coverage.",
      "severity": "medium",
      "confidence": "high",
      "recommendation": "Add a distinct qualified collaborator or team, then require at least one approving review for main and assign CODEOWNERS for workflows, release scripts, security policy, and audit contracts.",
      "tradeOffs": ["A second trusted maintainer adds coordination and merge latency.", "Enabling a required review before adding that identity would lock out the sole maintainer.", "The separately signed release-review gate remains mandatory even after source review is enforced."],
      "decisionRecord": null,
      "conflictsWithDecision": true,
      "evidence": ["Main protection now requires strict Aggregate cross-platform evidence and JavaScript security analysis checks with admin enforcement, linear history, conversation resolution, and no force pushes or deletions.", "Secret scanning, push protection, Dependabot security updates, vulnerability alerts, automated fixes, and private vulnerability reporting are enabled.", "Actions are restricted to GitHub-owned actions and CodeQL reports zero open alerts after reviewed dispositions.", "The repository has one write-capable collaborator, so required_pull_request_reviews remains unset; SECURITY.md requires independent review before production release."]
    }
  ],
  "limitations": ["This is a design-time review; no Azure environment or package deployment was accessed.", "Non-provider secret patterns and validity checks remain unavailable or disabled after best-effort enablement.", "No second qualified reviewer identity or trusted release-signing identity is currently provisioned."]
}